refs,hyps,same_indices,random_indices_x,same_index_bleu1,different_index_bleu1,same_index_bleu2,different_index_bleu2,same_index_bleu3,different_index_bleu3,same_index_bleu4,different_index_bleu4,same_index_rouge,different_index_rouge,average_bleu_rouge,text_ids,random_indices_y,sign_scores,different_scores_i2t
seine kaltfront erreicht morgen auch deutschland inklusive wolken .,"{'27August_2009_Thursday_tagesschau-3269', 'das kräftige tief das sich zur nordsee verlagert sorgt dafür dass weiter kalte luft zu uns strömt .'}","(230, 230)","[348, 501]",5.555555555555555,3.344358556104022,0.0,0.0,0.0,0.0,0.0,0.0,6.17283950611358,5.0505050505124585,2.3456790123338274,"His cold front will also reach Germany, including clouds, tomorrow","[348, 501]",39.08640193939209,22.91467666625977
am tag halten sich über dem südosten dichte wolken aus denen ein paar schneeflocken fallen .,"{'15December_2009_Tuesday_tagesschau-6963', 'in der südosthälfte bleibt es morgen meist bewölkt gebietsweise schneit es etwas .'}","(513, 513)","[53, 137]",6.107097367830394,21.42857142857143,0.0,0.0,0.0,0.0,0.0,0.0,6.753535674531798,22.80858676201238,2.5721266084724386,"During the day, dense clouds stay from the southeast of which a few snowflakes fall","[53, 137]",60.0426025390625,38.55406665802002
ein harscher wetterwechsel seit gestern sogar mit tornados .,"{'die wetterlage stellt sich jetzt um es gelten entsprechende unwetterwarnungen des deutschen wetterdienstes .', '24August_2010_Tuesday_heute-3007'}","(209, 209)","[393, 501]",7.142857142857142,12.101102614451984,0.0,0.0,0.0,0.0,0.0,0.0,7.975813417725853,10.155316606925242,3.023734112116599,A tough weather change since yesterday even with tornados,"[393, 501]",56.969635009765625,29.971306800842285
an der luftmassengrenze kommt es zu teilweise starken und gewittrigen regenfällen .,"{'13July_2009_Monday_tagesschau-7509', 'im bergland sind zum teil heftige gewitter unterwegs .'}","(549, 549)","[581, 454]",7.961459006375435,8.333333333333332,0.0,0.0,0.0,0.0,0.0,0.0,9.157509157490464,8.662961752148677,3.4237936327731804,At the air mass border there are partially heavy and steady rainfall,"[581, 454]",61.90508842468262,32.64496946334839
das kann ja manchmal ganz schön schnell gehen also ob es schön ist entscheiden natürlich sie meine damen und herren .,"{'der start in die neue woche sieht noch nicht so richtig aus aber zumindest in den nächsten zwei stunden wird es doch wärmer .', '20June_2011_Monday_heute-6510'}","(472, 472)","[176, 599]",8.333333333333332,16.666666666666668,0.0,0.0,0.0,0.0,0.0,0.0,8.810916179275823,16.666666666616667,3.4288499025218315,"Sometimes that can go very quickly so whether it is nice, of course you decide ladies and gentlemen","[176, 599]",61.5993537902832,18.778223514556885
der regen zieht im laufe der nacht richtung main .,"{'davor und dahinter gibt es dichte wolken mitunter auch dichtere wolken .', '16June_2010_Wednesday_tagesschau-8149'}","(586, 586)","[616, 364]",8.333333333333332,19.47001957678512,0.0,0.0,0.0,0.0,0.0,0.0,8.94428152486229,21.693121693096163,3.4555229716391245,The rain moves towards Main during night,"[616, 364]",43.61207628250122,38.41650676727295
auch vereinzelte graupelschauer oder kurze gewitter sind dabei .,"{'es kann einige hagel geben zum teil mit blitz und donner .', '19October_2010_Tuesday_tagesschau-8291'}","(597, 597)","[264, 155]",8.333333333333332,30.769230769230774,0.0,16.012815380508716,0.0,0.0,0.0,0.0,9.157509157440758,32.87981859404077,3.4981684981548185,There are also isolated porridge showers or short thunderstorms,"[264, 155]",70.22025203704834,44.18263339996338
